{
 "schema_version": "1.0",
 "symbol": "heldout/sequences.py::dedupe_sorted",
 "context_packet_digest": "sha256:286645b28168a7e4d8ace2615c62229723340462da710524bdd564cccad41e1e",
 "candidates": [
  {
   "precondition": {
    "kind": "literal",
    "value": true
   },
   "predicate": {
    "kind": "unchanged_argument",
    "name": "xs"
   },
   "rationale": "Docstring: the input list is not modified; code calls xs.sort().",
   "uncertainty": "in-place sort violates",
   "boundary_inputs": [
    {
     "xs": [
      3,
      1,
      2
     ]
    },
    {
     "xs": [
      2,
      1
     ]
    }
   ],
   "unsupported_dependencies": [],
   "input_profile": "bounded_builtin_int_list_v1",
   "source_ref": {
    "snippet": 0,
    "start_line": 4,
    "end_line": 11
   }
  },
  {
   "precondition": {
    "kind": "literal",
    "value": true
   },
   "predicate": {
    "kind": "le",
    "left": {
     "kind": "len",
     "value": {
      "kind": "result"
     }
    },
    "right": {
     "kind": "len",
     "value": {
      "kind": "arg",
      "name": "xs"
     }
    }
   },
   "rationale": "Distinct values cannot outnumber inputs.",
   "uncertainty": "none",
   "boundary_inputs": [
    {
     "xs": []
    },
    {
     "xs": [
      1,
      1,
      1
     ]
    }
   ],
   "unsupported_dependencies": [],
   "input_profile": "bounded_builtin_int_list_v1",
   "source_ref": {
    "snippet": 0,
    "start_line": 4,
    "end_line": 11
   }
  },
  {
   "precondition": {
    "kind": "gt",
    "left": {
     "kind": "len",
     "value": {
      "kind": "arg",
      "name": "xs"
     }
    },
    "right": {
     "kind": "literal",
     "value": 0
    }
   },
   "predicate": {
    "kind": "gt",
    "left": {
     "kind": "len",
     "value": {
      "kind": "result"
     }
    },
    "right": {
     "kind": "literal",
     "value": 0
    }
   },
   "rationale": "A nonempty input has at least one distinct value.",
   "uncertainty": "none",
   "boundary_inputs": [
    {
     "xs": [
      5
     ]
    },
    {
     "xs": [
      2,
      2
     ]
    }
   ],
   "unsupported_dependencies": [],
   "input_profile": "bounded_builtin_int_list_v1",
   "source_ref": {
    "snippet": 0,
    "start_line": 4,
    "end_line": 11
   }
  },
  {
   "precondition": {
    "kind": "eq",
    "left": {
     "kind": "len",
     "value": {
      "kind": "arg",
      "name": "xs"
     }
    },
    "right": {
     "kind": "literal",
     "value": 0
    }
   },
   "predicate": {
    "kind": "eq",
    "left": {
     "kind": "len",
     "value": {
      "kind": "result"
     }
    },
    "right": {
     "kind": "literal",
     "value": 0
    }
   },
   "rationale": "Empty input gives empty output.",
   "uncertainty": "none",
   "boundary_inputs": [
    {
     "xs": []
    }
   ],
   "unsupported_dependencies": [],
   "input_profile": "bounded_builtin_int_list_v1",
   "source_ref": {
    "snippet": 0,
    "start_line": 4,
    "end_line": 11
   }
  },
  {
   "precondition": {
    "kind": "eq",
    "left": {
     "kind": "len",
     "value": {
      "kind": "arg",
      "name": "xs"
     }
    },
    "right": {
     "kind": "literal",
     "value": 1
    }
   },
   "predicate": {
    "kind": "eq",
    "left": {
     "kind": "sum",
     "value": {
      "kind": "result"
     }
    },
    "right": {
     "kind": "sum",
     "value": {
      "kind": "arg",
      "name": "xs"
     }
    }
   },
   "rationale": "A single-element input is returned as is.",
   "uncertainty": "none",
   "boundary_inputs": [
    {
     "xs": [
      7
     ]
    }
   ],
   "unsupported_dependencies": [],
   "input_profile": "bounded_builtin_int_list_v1",
   "source_ref": {
    "snippet": 0,
    "start_line": 4,
    "end_line": 11
   }
  },
  {
   "precondition": {
    "kind": "literal",
    "value": true
   },
   "predicate": {
    "kind": "all_between",
    "value": {
     "kind": "result"
    },
    "lower": -1000,
    "upper": 1000
   },
   "rationale": "Outputs are drawn from the inputs, so stay in range.",
   "uncertainty": "none",
   "boundary_inputs": [
    {
     "xs": [
      1000,
      -1000
     ]
    }
   ],
   "unsupported_dependencies": [],
   "input_profile": "bounded_builtin_int_list_v1",
   "source_ref": {
    "snippet": 0,
    "start_line": 4,
    "end_line": 11
   }
  },
  {
   "precondition": {
    "kind": "literal",
    "value": true
   },
   "predicate": {
    "kind": "repeatability",
    "repeats": 3,
    "seed": 0,
    "comparison": "exact"
   },
   "rationale": "Deterministic; repeated calls on equal inputs agree.",
   "uncertainty": "state mutation could interfere",
   "boundary_inputs": [],
   "unsupported_dependencies": [],
   "input_profile": "bounded_builtin_int_list_v1",
   "source_ref": {
    "snippet": 0,
    "start_line": 4,
    "end_line": 11
   }
  }
 ]
}