{
 "schema_version": "1.0",
 "symbol": "heldout/stats.py::running_total",
 "context_packet_digest": "sha256:4b5a2e6f4dc1e5242721bd57ed4b9e8a7717b5d00fb0bae65f404b94594709fe",
 "candidates": [
  {
   "precondition": {
    "kind": "literal",
    "value": true
   },
   "predicate": {
    "kind": "eq",
    "left": {
     "kind": "len",
     "value": {
      "kind": "result"
     }
    },
    "right": {
     "kind": "len",
     "value": {
      "kind": "arg",
      "name": "xs"
     }
    }
   },
   "rationale": "One prefix sum per input element.",
   "uncertainty": "none",
   "boundary_inputs": [
    {
     "xs": []
    },
    {
     "xs": [
      1,
      2,
      3
     ]
    }
   ],
   "unsupported_dependencies": [],
   "input_profile": "bounded_builtin_int_list_v1",
   "source_ref": {
    "snippet": 0,
    "start_line": 23,
    "end_line": 30
   }
  },
  {
   "precondition": {
    "kind": "literal",
    "value": true
   },
   "predicate": {
    "kind": "unchanged_argument",
    "name": "xs"
   },
   "rationale": "Computing prefix sums must not mutate the input.",
   "uncertainty": "none",
   "boundary_inputs": [
    {
     "xs": [
      1,
      2,
      3
     ]
    }
   ],
   "unsupported_dependencies": [],
   "input_profile": "bounded_builtin_int_list_v1",
   "source_ref": {
    "snippet": 0,
    "start_line": 23,
    "end_line": 30
   }
  },
  {
   "precondition": {
    "kind": "eq",
    "left": {
     "kind": "len",
     "value": {
      "kind": "arg",
      "name": "xs"
     }
    },
    "right": {
     "kind": "literal",
     "value": 1
    }
   },
   "predicate": {
    "kind": "eq",
    "left": {
     "kind": "sum",
     "value": {
      "kind": "result"
     }
    },
    "right": {
     "kind": "sum",
     "value": {
      "kind": "arg",
      "name": "xs"
     }
    }
   },
   "rationale": "Single element: the only prefix sum is the element.",
   "uncertainty": "none",
   "boundary_inputs": [
    {
     "xs": [
      5
     ]
    },
    {
     "xs": [
      -3
     ]
    }
   ],
   "unsupported_dependencies": [],
   "input_profile": "bounded_builtin_int_list_v1",
   "source_ref": {
    "snippet": 0,
    "start_line": 23,
    "end_line": 30
   }
  },
  {
   "precondition": {
    "kind": "all_between",
    "value": {
     "kind": "arg",
     "name": "xs"
    },
    "lower": 0,
    "upper": 1000
   },
   "predicate": {
    "kind": "le",
    "left": {
     "kind": "sum",
     "value": {
      "kind": "arg",
      "name": "xs"
     }
    },
    "right": {
     "kind": "sum",
     "value": {
      "kind": "result"
     }
    }
   },
   "rationale": "For nonnegative inputs sum of prefix sums is at least the sum.",
   "uncertainty": "none",
   "boundary_inputs": [
    {
     "xs": [
      0
     ]
    },
    {
     "xs": [
      1,
      2,
      3
     ]
    }
   ],
   "unsupported_dependencies": [],
   "input_profile": "bounded_builtin_int_list_v1",
   "source_ref": {
    "snippet": 0,
    "start_line": 23,
    "end_line": 30
   }
  },
  {
   "precondition": {
    "kind": "all_between",
    "value": {
     "kind": "arg",
     "name": "xs"
    },
    "lower": 0,
    "upper": 1000
   },
   "predicate": {
    "kind": "all_between",
    "value": {
     "kind": "result"
    },
    "lower": 0,
    "upper": 16000
   },
   "rationale": "Nonnegative prefix sums of <=16 values of <=1000 stay in [0,16000].",
   "uncertainty": "none",
   "boundary_inputs": [
    {
     "xs": [
      1000,
      1000,
      1000,
      1000,
      1000,
      1000,
      1000,
      1000,
      1000,
      1000,
      1000,
      1000,
      1000,
      1000,
      1000,
      1000
     ]
    }
   ],
   "unsupported_dependencies": [],
   "input_profile": "bounded_builtin_int_list_v1",
   "source_ref": {
    "snippet": 0,
    "start_line": 23,
    "end_line": 30
   }
  },
  {
   "precondition": {
    "kind": "literal",
    "value": true
   },
   "predicate": {
    "kind": "all_between",
    "value": {
     "kind": "result"
    },
    "lower": -16000,
    "upper": 16000
   },
   "rationale": "Prefix sums are bounded by 16*1000.",
   "uncertainty": "none",
   "boundary_inputs": [
    {
     "xs": [
      -1000,
      -1000,
      -1000,
      -1000,
      -1000,
      -1000,
      -1000,
      -1000,
      -1000,
      -1000,
      -1000,
      -1000,
      -1000,
      -1000,
      -1000,
      -1000
     ]
    }
   ],
   "unsupported_dependencies": [],
   "input_profile": "bounded_builtin_int_list_v1",
   "source_ref": {
    "snippet": 0,
    "start_line": 23,
    "end_line": 30
   }
  },
  {
   "precondition": {
    "kind": "eq",
    "left": {
     "kind": "len",
     "value": {
      "kind": "arg",
      "name": "xs"
     }
    },
    "right": {
     "kind": "literal",
     "value": 0
    }
   },
   "predicate": {
    "kind": "eq",
    "left": {
     "kind": "len",
     "value": {
      "kind": "result"
     }
    },
    "right": {
     "kind": "literal",
     "value": 0
    }
   },
   "rationale": "Empty input gives empty output.",
   "uncertainty": "none",
   "boundary_inputs": [
    {
     "xs": []
    }
   ],
   "unsupported_dependencies": [],
   "input_profile": "bounded_builtin_int_list_v1",
   "source_ref": {
    "snippet": 0,
    "start_line": 23,
    "end_line": 30
   }
  },
  {
   "precondition": {
    "kind": "literal",
    "value": true
   },
   "predicate": {
    "kind": "repeatability",
    "repeats": 3,
    "seed": 0,
    "comparison": "exact"
   },
   "rationale": "Deterministic function.",
   "uncertainty": "none",
   "boundary_inputs": [],
   "unsupported_dependencies": [],
   "input_profile": "bounded_builtin_int_list_v1",
   "source_ref": {
    "snippet": 0,
    "start_line": 23,
    "end_line": 30
   }
  }
 ]
}