{"schema_version":"1.0","symbol":"heldout/scalars.py::floor_div_or_zero","context_packet_digest":"sha256:d1d4e05b344b9d9144cd7fe40fa6c5e5aa468f4cf5a453eaa460a9e0bdd55828","candidates":[{"precondition":{"kind":"eq","left":{"kind":"arg","name":"b"},"right":{"kind":"literal","value":0}},"predicate":{"kind":"eq","left":{"kind":"result"},"right":{"kind":"literal","value":0}},"input_profile":"bounded_builtin_ints_v1","source_ref":{"snippet":0,"start_line":14,"end_line":18},"rationale":"Docstring says the result is 0 when b is 0.","uncertainty":"none","unsupported_dependencies":[],"boundary_inputs":[{"a":5,"b":0}]},{"precondition":{"kind":"and","args":[{"kind":"gt","left":{"kind":"arg","name":"b"},"right":{"kind":"literal","value":0}},{"kind":"le","left":{"kind":"literal","value":0},"right":{"kind":"arg","name":"a"}}]},"predicate":{"kind":"and","args":[{"kind":"le","left":{"kind":"literal","value":0},"right":{"kind":"result"}},{"kind":"le","left":{"kind":"result"},"right":{"kind":"arg","name":"a"}}]},"input_profile":"bounded_builtin_ints_v1","source_ref":{"snippet":0,"start_line":14,"end_line":18},"rationale":"Floor division of a nonnegative a by a positive b is in [0,a].","uncertainty":"none","unsupported_dependencies":[],"boundary_inputs":[{"a":0,"b":1},{"a":7,"b":2}]},{"precondition":{"kind":"eq","left":{"kind":"arg","name":"a"},"right":{"kind":"literal","value":0}},"predicate":{"kind":"eq","left":{"kind":"result"},"right":{"kind":"literal","value":0}},"input_profile":"bounded_builtin_ints_v1","source_ref":{"snippet":0,"start_line":14,"end_line":18},"rationale":"Zero divided by anything is zero.","uncertainty":"none","unsupported_dependencies":[],"boundary_inputs":[{"a":0,"b":-3},{"a":0,"b":0}]},{"precondition":{"kind":"eq","left":{"kind":"arg","name":"b"},"right":{"kind":"literal","value":1}},"predicate":{"kind":"eq","left":{"kind":"result"},"right":{"kind":"arg","name":"a"}},"input_profile":"bounded_builtin_ints_v1","source_ref":{"snippet":0,"start_line":14,"end_line":18},"rationale":"Dividing by 1 returns a.","uncertainty":"none","unsupported_dependencies":[],"boundary_inputs":[{"a":-7,"b":1}]},{"precondition":{"kind":"and","args":[{"kind":"le","left":{"kind":"literal","value":0},"right":{"kind":"arg","name":"a"}},{"kind":"lt","left":{"kind":"arg","name":"a"},"right":{"kind":"arg","name":"b"}}]},"predicate":{"kind":"eq","left":{"kind":"result"},"right":{"kind":"literal","value":0}},"input_profile":"bounded_builtin_ints_v1","source_ref":{"snippet":0,"start_line":14,"end_line":18},"rationale":"Nonnegative a smaller than positive b floors to 0.","uncertainty":"none","unsupported_dependencies":[],"boundary_inputs":[{"a":3,"b":5}]},{"precondition":{"kind":"and","args":[{"kind":"lt","left":{"kind":"arg","name":"b"},"right":{"kind":"literal","value":0}},{"kind":"gt","left":{"kind":"arg","name":"a"},"right":{"kind":"literal","value":0}}]},"predicate":{"kind":"le","left":{"kind":"result"},"right":{"kind":"literal","value":0}},"input_profile":"bounded_builtin_ints_v1","source_ref":{"snippet":0,"start_line":14,"end_line":18},"rationale":"Positive over negative floors to a nonpositive value.","uncertainty":"none","unsupported_dependencies":[],"boundary_inputs":[{"a":7,"b":-2}]},{"precondition":{"kind":"literal","value":true},"predicate":{"kind":"and","args":[{"kind":"le","left":{"kind":"literal","value":-1000000.0},"right":{"kind":"result"}},{"kind":"le","left":{"kind":"result"},"right":{"kind":"literal","value":1000000.0}}]},"input_profile":"bounded_builtin_ints_v1","source_ref":{"snippet":0,"start_line":14,"end_line":18},"rationale":"Quotient magnitude is bounded by the dividend magnitude.","uncertainty":"none","unsupported_dependencies":[],"boundary_inputs":[{"a":-1000000,"b":1}]}]}