{
 "schema_version": "1.0",
 "symbol": "heldout/stats.py::count_positive",
 "context_packet_digest": "sha256:b143c8edc69b7475e6f3733c66d59936a42a989860131b57be7645e0d372e0ba",
 "candidates": [
  {
   "precondition": {
    "kind": "literal",
    "value": true
   },
   "predicate": {
    "kind": "and",
    "args": [
     {
      "kind": "le",
      "left": {
       "kind": "literal",
       "value": 0
      },
      "right": {
       "kind": "result"
      }
     },
     {
      "kind": "le",
      "left": {
       "kind": "result"
      },
      "right": {
       "kind": "len",
       "value": {
        "kind": "arg",
        "name": "xs"
       }
      }
     }
    ]
   },
   "rationale": "Docstring: count between 0 and len(xs).",
   "uncertainty": "none",
   "boundary_inputs": [
    {
     "xs": [
      1.0
     ]
    },
    {
     "xs": [
      -1.0,
      2.0
     ]
    }
   ],
   "unsupported_dependencies": [],
   "input_profile": "bounded_builtin_numeric_list_v1",
   "source_ref": {
    "snippet": 0,
    "start_line": 33,
    "end_line": 35
   }
  },
  {
   "precondition": {
    "kind": "all_between",
    "value": {
     "kind": "arg",
     "name": "xs"
    },
    "lower": -1000000.0,
    "upper": 0.0
   },
   "predicate": {
    "kind": "eq",
    "left": {
     "kind": "result"
    },
    "right": {
     "kind": "literal",
     "value": 0
    }
   },
   "rationale": "With no strictly positive values the count is 0; code counts zeros.",
   "uncertainty": "x >= 0 counts zero",
   "boundary_inputs": [
    {
     "xs": [
      0.0
     ]
    },
    {
     "xs": [
      0,
      -1
     ]
    },
    {
     "xs": [
      -1e-09
     ]
    }
   ],
   "unsupported_dependencies": [],
   "input_profile": "bounded_builtin_numeric_list_v1",
   "source_ref": {
    "snippet": 0,
    "start_line": 33,
    "end_line": 35
   }
  },
  {
   "precondition": {
    "kind": "all_between",
    "value": {
     "kind": "arg",
     "name": "xs"
    },
    "lower": 0.0,
    "upper": 0.0
   },
   "predicate": {
    "kind": "eq",
    "left": {
     "kind": "result"
    },
    "right": {
     "kind": "literal",
     "value": 0
    }
   },
   "rationale": "Zero is not strictly positive.",
   "uncertainty": "x >= 0 counts zero",
   "boundary_inputs": [
    {
     "xs": [
      0.0
     ]
    },
    {
     "xs": [
      0.0,
      0.0
     ]
    }
   ],
   "unsupported_dependencies": [],
   "input_profile": "bounded_builtin_numeric_list_v1",
   "source_ref": {
    "snippet": 0,
    "start_line": 33,
    "end_line": 35
   }
  },
  {
   "precondition": {
    "kind": "all_between",
    "value": {
     "kind": "arg",
     "name": "xs"
    },
    "lower": 1.0,
    "upper": 1000000.0
   },
   "predicate": {
    "kind": "eq",
    "left": {
     "kind": "result"
    },
    "right": {
     "kind": "len",
     "value": {
      "kind": "arg",
      "name": "xs"
     }
    }
   },
   "rationale": "All strictly positive values are all counted.",
   "uncertainty": "none",
   "boundary_inputs": [
    {
     "xs": [
      1.0
     ]
    },
    {
     "xs": [
      2,
      3
     ]
    }
   ],
   "unsupported_dependencies": [],
   "input_profile": "bounded_builtin_numeric_list_v1",
   "source_ref": {
    "snippet": 0,
    "start_line": 33,
    "end_line": 35
   }
  },
  {
   "precondition": {
    "kind": "literal",
    "value": true
   },
   "predicate": {
    "kind": "unchanged_argument",
    "name": "xs"
   },
   "rationale": "Counting must not mutate the input.",
   "uncertainty": "none",
   "boundary_inputs": [
    {
     "xs": [
      1.0,
      -1.0
     ]
    }
   ],
   "unsupported_dependencies": [],
   "input_profile": "bounded_builtin_numeric_list_v1",
   "source_ref": {
    "snippet": 0,
    "start_line": 33,
    "end_line": 35
   }
  },
  {
   "precondition": {
    "kind": "literal",
    "value": true
   },
   "predicate": {
    "kind": "repeatability",
    "repeats": 3,
    "seed": 0,
    "comparison": "exact"
   },
   "rationale": "Deterministic function.",
   "uncertainty": "none",
   "boundary_inputs": [],
   "unsupported_dependencies": [],
   "input_profile": "bounded_builtin_numeric_list_v1",
   "source_ref": {
    "snippet": 0,
    "start_line": 33,
    "end_line": 35
   }
  }
 ]
}