{
 "schema_version": "1.0",
 "symbol": "heldout/report.py::summary_score",
 "context_packet_digest": "sha256:d8b437b66266d79d2726ac3212039b0448bd8ea11e283404400757c61bbbe0bf",
 "candidates": [
  {
   "precondition": {
    "kind": "literal",
    "value": true
   },
   "predicate": {
    "kind": "unchanged_argument",
    "name": "xs"
   },
   "input_profile": "bounded_builtin_numeric_list_v1",
   "source_ref": {
    "snippet": 0,
    "start_line": 6,
    "end_line": 8
   },
   "rationale": "Scoring should not mutate its input list.",
   "uncertainty": "callees mean_of/spread assumed pure",
   "unsupported_dependencies": [
    "heldout/stats.py::mean_of",
    "heldout/stats.py::spread"
   ],
   "boundary_inputs": [
    {
     "xs": [
      1.0,
      2.0
     ]
    }
   ]
  },
  {
   "precondition": {
    "kind": "literal",
    "value": true
   },
   "predicate": {
    "kind": "repeatability",
    "repeats": 3,
    "seed": 0,
    "comparison": "exact"
   },
   "input_profile": "bounded_builtin_numeric_list_v1",
   "source_ref": {
    "snippet": 0,
    "start_line": 6,
    "end_line": 8
   },
   "rationale": "Score is a deterministic function of the list.",
   "uncertainty": "depends on callees",
   "unsupported_dependencies": [
    "heldout/stats.py::mean_of",
    "heldout/stats.py::spread"
   ],
   "boundary_inputs": []
  },
  {
   "precondition": {
    "kind": "eq",
    "left": {
     "kind": "len",
     "value": {
      "kind": "arg",
      "name": "xs"
     }
    },
    "right": {
     "kind": "literal",
     "value": 1
    }
   },
   "predicate": {
    "kind": "approx_eq",
    "left": {
     "kind": "result"
    },
    "right": {
     "kind": "sum",
     "value": {
      "kind": "arg",
      "name": "xs"
     }
    },
    "atol": 1e-09,
    "rtol": 1e-09,
    "require_finite": true
   },
   "input_profile": "bounded_builtin_numeric_list_v1",
   "source_ref": {
    "snippet": 0,
    "start_line": 6,
    "end_line": 8
   },
   "rationale": "With one value the spread is 0 so the score equals that value.",
   "uncertainty": "depends on spread of a singleton",
   "unsupported_dependencies": [
    "heldout/stats.py::spread"
   ],
   "boundary_inputs": [
    {
     "xs": [
      7.0
     ]
    },
    {
     "xs": [
      -3.5
     ]
    }
   ]
  },
  {
   "precondition": {
    "kind": "all_between",
    "value": {
     "kind": "arg",
     "name": "xs"
    },
    "lower": 0,
    "upper": 1000000.0
   },
   "predicate": {
    "kind": "le",
    "left": {
     "kind": "literal",
     "value": 0
    },
    "right": {
     "kind": "result"
    }
   },
   "input_profile": "bounded_builtin_numeric_list_v1",
   "source_ref": {
    "snippet": 0,
    "start_line": 6,
    "end_line": 8
   },
   "rationale": "Mean and spread of nonnegative values are both nonnegative.",
   "uncertainty": "depends on callees",
   "unsupported_dependencies": [
    "heldout/stats.py::mean_of",
    "heldout/stats.py::spread"
   ],
   "boundary_inputs": [
    {
     "xs": [
      0
     ]
    },
    {
     "xs": [
      0,
      1000000.0
     ]
    }
   ]
  },
  {
   "precondition": {
    "kind": "all_between",
    "value": {
     "kind": "arg",
     "name": "xs"
    },
    "lower": 0,
    "upper": 1000000.0
   },
   "predicate": {
    "kind": "le",
    "left": {
     "kind": "result"
    },
    "right": {
     "kind": "literal",
     "value": 2000000.0
    }
   },
   "input_profile": "bounded_builtin_numeric_list_v1",
   "source_ref": {
    "snippet": 0,
    "start_line": 6,
    "end_line": 8
   },
   "rationale": "Mean <= 1e6 and spread <= 1e6 for values in [0,1e6].",
   "uncertainty": "depends on callees",
   "unsupported_dependencies": [
    "heldout/stats.py::mean_of",
    "heldout/stats.py::spread"
   ],
   "boundary_inputs": [
    {
     "xs": [
      0,
      1000000.0
     ]
    }
   ]
  }
 ]
}