{"schema_version":"1.0","symbol":"heldout/sequences.py::pairwise_diffs","context_packet_digest":"sha256:359e8d81b2bc7eb3b74848e99dfd5246b1a1a35863c2eac10a4b6d8bd36e9b7f","candidates":[{"precondition":{"kind":"le","left":{"kind":"len","value":{"kind":"arg","name":"xs"}},"right":{"kind":"literal","value":1}},"predicate":{"kind":"eq","left":{"kind":"len","value":{"kind":"result"}},"right":{"kind":"literal","value":0}},"input_profile":"bounded_builtin_int_list_v1","source_ref":{"snippet":0,"start_line":14,"end_line":16},"rationale":"Fewer than two elements give no consecutive pairs.","uncertainty":"none","unsupported_dependencies":[],"boundary_inputs":[{"xs":[]},{"xs":[4]}]},{"precondition":{"kind":"eq","left":{"kind":"len","value":{"kind":"arg","name":"xs"}},"right":{"kind":"literal","value":2}},"predicate":{"kind":"eq","left":{"kind":"len","value":{"kind":"result"}},"right":{"kind":"literal","value":1}},"input_profile":"bounded_builtin_int_list_v1","source_ref":{"snippet":0,"start_line":14,"end_line":16},"rationale":"Two elements give exactly one difference.","uncertainty":"none","unsupported_dependencies":[],"boundary_inputs":[{"xs":[1,4]}]},{"precondition":{"kind":"gt","left":{"kind":"len","value":{"kind":"arg","name":"xs"}},"right":{"kind":"literal","value":0}},"predicate":{"kind":"lt","left":{"kind":"len","value":{"kind":"result"}},"right":{"kind":"len","value":{"kind":"arg","name":"xs"}}},"input_profile":"bounded_builtin_int_list_v1","source_ref":{"snippet":0,"start_line":14,"end_line":16},"rationale":"Result has len(xs)-1 entries, fewer than a nonempty input.","uncertainty":"none","unsupported_dependencies":[],"boundary_inputs":[{"xs":[1,2,3]}]},{"precondition":{"kind":"literal","value":true},"predicate":{"kind":"all_between","value":{"kind":"result"},"lower":-2000,"upper":2000},"input_profile":"bounded_builtin_int_list_v1","source_ref":{"snippet":0,"start_line":14,"end_line":16},"rationale":"Differences of values in [-1000,1000] lie in [-2000,2000].","uncertainty":"none","unsupported_dependencies":[],"boundary_inputs":[{"xs":[-1000,1000]},{"xs":[1000,-1000]}]},{"precondition":{"kind":"literal","value":true},"predicate":{"kind":"le","left":{"kind":"len","value":{"kind":"result"}},"right":{"kind":"len","value":{"kind":"arg","name":"xs"}}},"input_profile":"bounded_builtin_int_list_v1","source_ref":{"snippet":0,"start_line":14,"end_line":16},"rationale":"Result is never longer than the input.","uncertainty":"none","unsupported_dependencies":[],"boundary_inputs":[{"xs":[]}]},{"precondition":{"kind":"literal","value":true},"predicate":{"kind":"unchanged_argument","name":"xs"},"input_profile":"bounded_builtin_int_list_v1","source_ref":{"snippet":0,"start_line":14,"end_line":16},"rationale":"Must not mutate input.","uncertainty":"none","unsupported_dependencies":[],"boundary_inputs":[{"xs":[1,2,3]}]},{"precondition":{"kind":"literal","value":true},"predicate":{"kind":"repeatability","repeats":3,"seed":0,"comparison":"exact"},"input_profile":"bounded_builtin_int_list_v1","source_ref":{"snippet":0,"start_line":14,"end_line":16},"rationale":"Pure function.","uncertainty":"none","unsupported_dependencies":[],"boundary_inputs":[]}]}