{
 "schema_version": "1.0",
 "symbol": "heldout/sequences.py::rotate_left",
 "context_packet_digest": "sha256:231e0c42fc3feec4b854ab67e61848a1436735088560284d81273f95e69fb816",
 "candidates": [
  {
   "precondition": {
    "kind": "literal",
    "value": true
   },
   "predicate": {
    "kind": "eq",
    "left": {
     "kind": "len",
     "value": {
      "kind": "result"
     }
    },
    "right": {
     "kind": "len",
     "value": {
      "kind": "arg",
      "name": "xs"
     }
    }
   },
   "rationale": "Docstring: same length as the input.",
   "uncertainty": "none",
   "boundary_inputs": [
    {
     "xs": []
    },
    {
     "xs": [
      1
     ]
    },
    {
     "xs": [
      1,
      2,
      3
     ]
    }
   ],
   "unsupported_dependencies": [],
   "input_profile": "bounded_builtin_int_list_v1",
   "source_ref": {
    "snippet": 0,
    "start_line": 24,
    "end_line": 28
   }
  },
  {
   "precondition": {
    "kind": "literal",
    "value": true
   },
   "predicate": {
    "kind": "eq",
    "left": {
     "kind": "sum",
     "value": {
      "kind": "result"
     }
    },
    "right": {
     "kind": "sum",
     "value": {
      "kind": "arg",
      "name": "xs"
     }
    }
   },
   "rationale": "Same elements implies equal sums.",
   "uncertainty": "none",
   "boundary_inputs": [
    {
     "xs": [
      1,
      2,
      3
     ]
    }
   ],
   "unsupported_dependencies": [],
   "input_profile": "bounded_builtin_int_list_v1",
   "source_ref": {
    "snippet": 0,
    "start_line": 24,
    "end_line": 28
   }
  },
  {
   "precondition": {
    "kind": "literal",
    "value": true
   },
   "predicate": {
    "kind": "unchanged_argument",
    "name": "xs"
   },
   "rationale": "Rotation builds a new list and must not mutate the input.",
   "uncertainty": "none",
   "boundary_inputs": [
    {
     "xs": [
      1,
      2
     ]
    }
   ],
   "unsupported_dependencies": [],
   "input_profile": "bounded_builtin_int_list_v1",
   "source_ref": {
    "snippet": 0,
    "start_line": 24,
    "end_line": 28
   }
  },
  {
   "precondition": {
    "kind": "literal",
    "value": true
   },
   "predicate": {
    "kind": "all_between",
    "value": {
     "kind": "result"
    },
    "lower": -1000,
    "upper": 1000
   },
   "rationale": "Elements come from the input so stay in range.",
   "uncertainty": "none",
   "boundary_inputs": [
    {
     "xs": [
      1000,
      -1000
     ]
    }
   ],
   "unsupported_dependencies": [],
   "input_profile": "bounded_builtin_int_list_v1",
   "source_ref": {
    "snippet": 0,
    "start_line": 24,
    "end_line": 28
   }
  },
  {
   "precondition": {
    "kind": "eq",
    "left": {
     "kind": "len",
     "value": {
      "kind": "arg",
      "name": "xs"
     }
    },
    "right": {
     "kind": "literal",
     "value": 0
    }
   },
   "predicate": {
    "kind": "eq",
    "left": {
     "kind": "len",
     "value": {
      "kind": "result"
     }
    },
    "right": {
     "kind": "literal",
     "value": 0
    }
   },
   "rationale": "Empty input gives empty output.",
   "uncertainty": "none",
   "boundary_inputs": [
    {
     "xs": []
    }
   ],
   "unsupported_dependencies": [],
   "input_profile": "bounded_builtin_int_list_v1",
   "source_ref": {
    "snippet": 0,
    "start_line": 24,
    "end_line": 28
   }
  },
  {
   "precondition": {
    "kind": "literal",
    "value": true
   },
   "predicate": {
    "kind": "repeatability",
    "repeats": 3,
    "seed": 0,
    "comparison": "exact"
   },
   "rationale": "Deterministic function.",
   "uncertainty": "none",
   "boundary_inputs": [],
   "unsupported_dependencies": [],
   "input_profile": "bounded_builtin_int_list_v1",
   "source_ref": {
    "snippet": 0,
    "start_line": 24,
    "end_line": 28
   }
  }
 ]
}