{"schema_version":"1.0","symbol":"heldout/stats.py::running_total","context_packet_digest":"sha256:4b5a2e6f4dc1e5242721bd57ed4b9e8a7717b5d00fb0bae65f404b94594709fe","candidates":[{"precondition":{"kind":"literal","value":true},"predicate":{"kind":"eq","left":{"kind":"len","value":{"kind":"result"}},"right":{"kind":"len","value":{"kind":"arg","name":"xs"}}},"input_profile":"bounded_builtin_int_list_v1","source_ref":{"snippet":0,"start_line":23,"end_line":30},"rationale":"Prefix sums have one entry per input element.","uncertainty":"none","unsupported_dependencies":["out.append"],"boundary_inputs":[{"xs":[]},{"xs":[1,2,3]}]},{"precondition":{"kind":"eq","left":{"kind":"len","value":{"kind":"arg","name":"xs"}},"right":{"kind":"literal","value":1}},"predicate":{"kind":"eq","left":{"kind":"sum","value":{"kind":"result"}},"right":{"kind":"sum","value":{"kind":"arg","name":"xs"}}},"input_profile":"bounded_builtin_int_list_v1","source_ref":{"snippet":0,"start_line":23,"end_line":30},"rationale":"The only prefix sum of a singleton is the element.","uncertainty":"none","unsupported_dependencies":["out.append"],"boundary_inputs":[{"xs":[5]}]},{"precondition":{"kind":"all_between","value":{"kind":"arg","name":"xs"},"lower":0,"upper":1000},"predicate":{"kind":"all_between","value":{"kind":"result"},"lower":0,"upper":16000},"input_profile":"bounded_builtin_int_list_v1","source_ref":{"snippet":0,"start_line":23,"end_line":30},"rationale":"Nonnegative inputs give nonnegative prefix sums bounded by 16*1000.","uncertainty":"none","unsupported_dependencies":["out.append"],"boundary_inputs":[{"xs":[1000,1000,1000,1000,1000,1000,1000,1000,1000,1000,1000,1000,1000,1000,1000,1000]}]},{"precondition":{"kind":"literal","value":true},"predicate":{"kind":"all_between","value":{"kind":"result"},"lower":-16000,"upper":16000},"input_profile":"bounded_builtin_int_list_v1","source_ref":{"snippet":0,"start_line":23,"end_line":30},"rationale":"Prefix sums of at most 16 values in [-1000,1000] are bounded.","uncertainty":"none","unsupported_dependencies":["out.append"],"boundary_inputs":[{"xs":[-1000,-1000,-1000,-1000,-1000,-1000,-1000,-1000,-1000,-1000,-1000,-1000,-1000,-1000,-1000,-1000]}]},{"precondition":{"kind":"literal","value":true},"predicate":{"kind":"unchanged_argument","name":"xs"},"input_profile":"bounded_builtin_int_list_v1","source_ref":{"snippet":0,"start_line":23,"end_line":30},"rationale":"Must not mutate input.","uncertainty":"none","unsupported_dependencies":[],"boundary_inputs":[{"xs":[1,2,3]}]},{"precondition":{"kind":"eq","left":{"kind":"len","value":{"kind":"arg","name":"xs"}},"right":{"kind":"literal","value":0}},"predicate":{"kind":"eq","left":{"kind":"len","value":{"kind":"result"}},"right":{"kind":"literal","value":0}},"input_profile":"bounded_builtin_int_list_v1","source_ref":{"snippet":0,"start_line":23,"end_line":30},"rationale":"Empty input gives empty output.","uncertainty":"none","unsupported_dependencies":[],"boundary_inputs":[{"xs":[]}]}]}